{
  "$schema": "https://json-schema.org/draft/2020-12/schema",
  "title": "Phase 11 Aomori maximum-depth manifest",
  "type": "object",
  "additionalProperties": false,
  "required": [
    "id", "phase", "status", "prefecture_code", "source_catalog",
    "normalizer", "record_schema", "expected_normalization",
    "maximum_depth_rule", "history_boundary", "non_goals", "updated_at"
  ],
  "properties": {
    "id": {"const": "phase11-aomori-normalization"},
    "phase": {"const": 11},
    "status": {"const": "reviewed_maximum_depth"},
    "prefecture_code": {"const": "02"},
    "source_catalog": {"const": "data/reviewed/phase9/02.json"},
    "normalizer": {"const": "scripts/normalize_phase11_aomori.py"},
    "record_schema": {"const": "schemas/phase11_record_linkage.schema.json"},
    "expected_normalization": {
      "type": "object",
      "additionalProperties": false,
      "required": [
        "record_count", "linked_record_count", "partial_record_count",
        "not_linked_record_count", "indicator_series_count",
        "annual_actual_available_count", "future_target_available_count",
        "reviewed_maximum_depth_record_count",
        "policy_achievement_assessment_count"
      ],
      "properties": {
        "record_count": {"const": 1},
        "linked_record_count": {"const": 0},
        "partial_record_count": {"const": 1},
        "not_linked_record_count": {"const": 0},
        "indicator_series_count": {"const": 1},
        "annual_actual_available_count": {"const": 0},
        "future_target_available_count": {"const": 0},
        "reviewed_maximum_depth_record_count": {"const": 1},
        "policy_achievement_assessment_count": {"const": 0}
      }
    },
    "maximum_depth_rule": {"type": "string", "minLength": 120},
    "history_boundary": {"type": "string", "minLength": 100},
    "non_goals": {
      "type": "array",
      "minItems": 4,
      "uniqueItems": true,
      "items": {"type": "string", "minLength": 30}
    },
    "updated_at": {"type": "string", "format": "date"}
  }
}
