{
  "id": "phase11-aomori-normalization",
  "phase": 11,
  "status": "reviewed_maximum_depth",
  "prefecture_code": "02",
  "source_catalog": "data/reviewed/phase9/02.json",
  "normalizer": "scripts/normalize_phase11_aomori.py",
  "record_schema": "schemas/phase11_record_linkage.schema.json",
  "expected_normalization": {
    "record_count": 1,
    "linked_record_count": 0,
    "partial_record_count": 1,
    "not_linked_record_count": 0,
    "indicator_series_count": 1,
    "annual_actual_available_count": 0,
    "future_target_available_count": 0,
    "reviewed_maximum_depth_record_count": 1,
    "policy_achievement_assessment_count": 0
  },
  "maximum_depth_rule": "The reviewed current-plan source contains one observation statement about the 2011-2021 trend in per-capita prefectural income. It does not provide a reviewed future target or a separately linked annual actual record.",
  "history_boundary": "Current-plan observation indicators, prior-plan KPI series, and policy-inspection self-evaluations remain separate layers. No old series or self-evaluation is inherited automatically.",
  "non_goals": [
    "Do not parse several numeric tokens into an inferred single series.",
    "Do not treat the reviewed observation statement as a future target.",
    "Do not treat the plan text as a separately reviewed annual actual.",
    "Do not calculate achievement, causality, or cross-prefecture ranking."
  ],
  "updated_at": "2026-08-02"
}
